{"authority":{"address":"Postboks 600 Sentrum, NO-3507 Hoenefoss, NORWAY","email":"post@kartverket.no","name":"Kartverket","url":"https://www.kartverket.no/til-lands/posisjon/transformere-koordinater"},"description":"Triangulation to transform coordinates from EUREF89 (EPSG:4258) to NGO1948 (EPSG:4273), with longitude/latitude order.","extent":{"name":"Norway - onshore","parameters":{"bbox":[4.68,57.93,31.22,71.21]},"type":"bbox"},"file_type":"triangulation_file","format_version":"1.0","input_crs":"EPSG:4258","license":"Creative Commons Attribution 4.0 International","name":"tinshift_simplified_etrs89_ngo48.json","output_crs":"EPSG:4273","publication_date":"2021-03-03T10:08:55.88Z","transformed_components":["horizontal"],"triangles":[[20,19,5],[20,28,19],[5,26,20],[28,36,19],[25,24,5],[5,24,26],[20,32,28],[28,13,36],[25,5,19],[2,25,19],[15,13,28],[36,2,19],[13,2,36],[32,15,28],[26,21,20],[20,0,32],[23,21,26],[24,23,26],[22,0,20],[15,33,13],[13,33,2],[8,9,21],[21,22,20],[18,4,32],[32,4,15],[15,27,33],[9,22,21],[34,27,15],[10,1,0],[0,18,32],[30,18,0],[16,34,12],[4,34,15],[6,8,23],[23,8,21],[1,30,0],[12,34,4],[25,6,24],[24,6,23],[34,29,27],[27,29,33],[33,29,2],[22,10,0],[17,14,30],[3,10,22],[34,35,29],[16,35,34],[12,4,31],[31,4,18],[17,30,1],[30,14,18],[14,31,18],[12,31,16],[10,17,1],[14,17,31],[8,3,9],[9,3,22],[11,3,8],[6,7,8],[7,11,8]],"triangles_columns":["idx_vertex1","idx_vertex2","idx_vertex3"],"version":"1.2","vertices":[[10.5680110964,59.8287112888,10.572807685,59.8279216141],[10.5593886459,59.8114663879,10.5641821497,59.8106753272],[10.5708852465,59.9925378474,10.5757047163,59.9917649517],[10.7559654748,59.8315857188,10.760777932,59.8307897136],[10.5048780867,59.8809865177,10.5096755401,59.8802032878],[10.6320197818,59.9413249493,10.6368374086,59.9405449096],[10.7333021491,59.9693392211,10.7381321725,59.9685586306],[10.8087251886,59.9499447253,10.8135588647,59.9491594199],[10.7376120371,59.9025359576,10.7424329797,59.9017479716],[10.6794285495,59.8357326941,10.684235043,59.8349398303],[10.608315398,59.7797041504,10.6131080723,59.7789080207],[10.8420674345,59.8811435278,10.8468944229,59.8803495769],[10.4625380162,59.8877584196,10.467334834,59.886978296],[10.5369555492,59.9572147837,10.5417672219,59.9564392056],[10.4823826917,59.8323587006,10.4871729727,59.8315726135],[10.5220720426,59.9332358009,10.5268798281,59.9324585819],[10.4608842933,59.9166985713,10.4656842539,59.9159215302],[10.472460354,59.8240900858,10.4772485513,59.8233036322],[10.5121497049,59.8505496531,10.5169447933,59.8497639937],[10.5981432986,59.9464655845,10.6029591477,59.9456872117],[10.619641697,59.8885852811,10.6244508715,59.8877998579],[10.6709071086,59.8488959302,10.6757147562,59.8481047244],[10.6411400954,59.8075528563,10.645939402,59.8067584485],[10.7056352907,59.9216597402,10.7104562136,59.9208749159],[10.6725608315,59.9696177059,10.6773855287,59.9688392702],[10.6477549872,59.9911161043,10.6525810632,59.9903408572],[10.6692533856,59.929928355,10.674072379,59.9291457621],[10.4989199213,59.9481193075,10.5037280769,59.9473441284],[10.5634151165,59.9166985713,10.5682239472,59.9159180194],[10.4774215228,59.9514267534,10.4822286336,59.9506525753],[10.5138034278,59.8290512547,10.5185960158,59.8282636568],[10.4641917392,59.8522033761,10.4689830651,59.8514198475],[10.5386092722,59.8869315581,10.543411201,59.8861484358],[10.5187645967,59.9630028141,10.5235757746,59.9622283914],[10.4840364147,59.9150448484,10.4888385775,59.914266783],[10.4643295436,59.9375502427,10.4691321615,59.9367749937],[10.5677670658,59.9652883024,10.5725818874,59.9645124836]],"vertices_columns":["source_x","source_y","target_x","target_y"]}